"No.","Time","Source","Destination","Protocol","Length","Info","src_port","dst_posrt"
"1","0.000000","192.168.3.131","72.14.213.138","HTTP","997","GET /complete/search?client=chrome&hl=en-US&q=cr HTTP/1.1 ","57011","80"
"2","0.029841","72.14.213.138","192.168.3.131","HTTP","440","HTTP/1.1 200 OK  (text/javascript)","80","57011"
"3","0.223883","192.168.3.131","72.14.213.102","TCP","66","55950  >  80 [SYN] Seq=0 Win=8192 Len=0 MSS=1460 WS=4 SACK_PERM=1","55950","80"
"4","0.229423","192.168.3.131","72.14.213.138","TCP","54","57011  >  80 [ACK] Seq=944 Ack=387 Win=16192 Len=0","57011","80"
"5","0.242649","72.14.213.102","192.168.3.131","TCP","66","80  >  55950 [SYN, ACK] Seq=0 Ack=1 Win=5720 Len=0 MSS=1430 SACK_PERM=1 WS=64","80","55950"
"6","0.242696","192.168.3.131","72.14.213.102","TCP","54","55950  >  80 [ACK] Seq=1 Ack=1 Win=65780 Len=0","55950","80"
"7","0.243050","192.168.3.131","72.14.213.102","HTTP","998","GET /complete/search?client=chrome&hl=en-US&q=msn HTTP/1.1 ","55950","80"
"8","0.262981","192.168.3.131","72.14.213.102","TCP","54","55950  >  80 [FIN, ACK] Seq=945 Ack=1 Win=65780 Len=0","55950","80"
"9","0.264074","72.14.213.102","192.168.3.131","TCP","60","80  >  55950 [ACK] Seq=1 Ack=945 Win=7616 Len=0","80","55950"
"10","0.276671","72.14.213.102","192.168.3.131","HTTP","541","HTTP/1.1 200 OK  (text/javascript)","80","55950"
"11","0.276759","192.168.3.131","72.14.213.102","TCP","54","55950  >  80 [RST, ACK] Seq=946 Ack=488 Win=0 Len=0","55950","80"
"12","0.282368","72.14.213.102","192.168.3.131","TCP","60","80  >  55950 [FIN, ACK] Seq=488 Ack=946 Win=7616 Len=0","80","55950"
"13","0.443719","192.168.3.131","72.14.213.147","TCP","66","52152  >  443 [SYN] Seq=0 Win=8192 Len=0 MSS=1460 WS=4 SACK_PERM=1","52152","443"
"14","0.462314","72.14.213.147","192.168.3.131","TCP","66","443  >  52152 [SYN, ACK] Seq=0 Ack=1 Win=5720 Len=0 MSS=1430 SACK_PERM=1 WS=64","443","52152"
"15","0.462403","192.168.3.131","72.14.213.147","TCP","54","52152  >  443 [ACK] Seq=1 Ack=1 Win=65780 Len=0","52152","443"
"16","0.463166","192.168.3.131","72.14.213.147","TLSv1","231","Client Hello","52152","443"
"17","0.481874","72.14.213.147","192.168.3.131","TCP","60","443  >  52152 [ACK] Seq=1 Ack=178 Win=6848 Len=0","443","52152"
"18","0.483296","72.14.213.147","192.168.3.131","TLSv1","1484","Server Hello","443","52152"
"19","0.484121","72.14.213.147","192.168.3.131","TLSv1","345","Certificate, Server Hello Done","443","52152"
"20","0.484150","192.168.3.131","72.14.213.147","TCP","54","52152  >  443 [ACK] Seq=178 Ack=1722 Win=65780 Len=0","52152","443"
"21","0.487784","192.168.3.131","72.14.213.147","TLSv1","329","Client Key Exchange, Change Cipher Spec, Encrypted Handshake Message, Application Data","52152","443"
"22","0.508847","72.14.213.147","192.168.3.131","TLSv1","280","New Session Ticket, Change Cipher Spec, Encrypted Handshake Message","443","52152"
"23","0.509662","72.14.213.147","192.168.3.131","TLSv1","99","Application Data","443","52152"
"24","0.509663","72.14.213.147","192.168.3.131","TCP","60","[TCP ACKed unseen segment] 443  >  52152 [ACK] Seq=1993 Ack=2279 Win=13632 Len=0","443","52152"
"25","0.509701","192.168.3.131","72.14.213.147","TCP","54","[TCP Previous segment not captured] 52152  >  443 [ACK] Seq=2279 Ack=1993 Win=65508 Len=0","52152","443"
"26","0.619150","192.168.3.131","65.55.206.209","TCP","66","55953  >  80 [SYN] Seq=0 Win=8192 Len=0 MSS=1460 WS=4 SACK_PERM=1","55953","80"
"27","0.650553","72.14.213.147","192.168.3.131","TLSv1","440","[TCP ACKed unseen segment] , Application Data","443","52152"
"28","0.651432","72.14.213.147","192.168.3.131","TLSv1","1484","Application Data","443","52152"
"29","0.651434","72.14.213.147","192.168.3.131","TLSv1","100","Application Data","443","52152"
"30","0.651478","192.168.3.131","72.14.213.147","TCP","54","52152  >  443 [ACK] Seq=2279 Ack=3855 Win=65780 Len=0","52152","443"
"31","0.652967","72.14.213.147","192.168.3.131","TLSv1","1484","Application Data","443","52152"
"32","0.652969","72.14.213.147","192.168.3.131","TLSv1","1085","Application Data, Application Data","443","52152"
"33","0.653019","192.168.3.131","72.14.213.147","TCP","54","52152  >  443 [ACK] Seq=2279 Ack=6316 Win=65780 Len=0","52152","443"
"34","0.679174","72.14.213.147","192.168.3.131","TLSv1","1484","Application Data","443","52152"
"35","0.679177","72.14.213.147","192.168.3.131","TLSv1","100","Application Data","443","52152"
"36","0.679236","192.168.3.131","72.14.213.147","TCP","54","52152  >  443 [ACK] Seq=2279 Ack=7792 Win=65780 Len=0","52152","443"
"37","0.679993","72.14.213.147","192.168.3.131","TLSv1","1484","Application Data","443","52152"
"38","0.679994","72.14.213.147","192.168.3.131","TLSv1","684","Application Data","443","52152"
"39","0.680017","192.168.3.131","72.14.213.147","TCP","54","52152  >  443 [ACK] Seq=2279 Ack=9852 Win=65780 Len=0","52152","443"
"40","0.683912","72.14.213.147","192.168.3.131","TLSv1","1484","Application Data","443","52152"
"41","0.684664","72.14.213.147","192.168.3.131","TLSv1","1484","Application Data, Application Data","443","52152"
"42","0.684665","72.14.213.147","192.168.3.131","TLSv1","198","Application Data","443","52152"
"43","0.684697","192.168.3.131","72.14.213.147","TCP","54","52152  >  443 [ACK] Seq=2279 Ack=12856 Win=65780 Len=0","52152","443"
"44","0.685465","72.14.213.147","192.168.3.131","TLSv1","863","Application Data, Application Data","443","52152"
"45","0.697918","65.55.206.209","192.168.3.131","TCP","60","80  >  55953 [SYN, ACK] Seq=0 Ack=1 Win=8190 Len=0 MSS=1460","80","55953"
"46","0.697991","192.168.3.131","65.55.206.209","TCP","54","55953  >  80 [ACK] Seq=1 Ack=1 Win=64240 Len=0","55953","80"
"47","0.698384","192.168.3.131","65.55.206.209","HTTP","515","GET / HTTP/1.1 ","55953","80"
"48","0.709631","192.168.3.131","72.14.213.147","TLSv1","303","Application Data","52152","443"
"49","0.726173","72.14.213.147","192.168.3.131","TLSv1","1484","Application Data","443","52152"
"50","0.726988","72.14.213.147","192.168.3.131","TLSv1","1484","Application Data [TCP segment of a reassembled PDU]","443","52152"
"51","0.726989","72.14.213.147","192.168.3.131","TLSv1","173","Application Data","443","52152"
"52","0.727033","192.168.3.131","72.14.213.147","TCP","54","52152  >  443 [ACK] Seq=2528 Ack=16644 Win=65780 Len=0","52152","443"
"53","0.727805","72.14.213.147","192.168.3.131","TLSv1","1484","Application Data, Application Data","443","52152"
"54","0.728568","72.14.213.147","192.168.3.131","TLSv1","1484","Application Data [TCP segment of a reassembled PDU]","443","52152"
"55","0.728588","192.168.3.131","72.14.213.147","TCP","54","52152  >  443 [ACK] Seq=2528 Ack=19504 Win=65780 Len=0","52152","443"
"56","0.729330","72.14.213.147","192.168.3.131","TLSv1","1391","Application Data","443","52152"
"57","0.729333","72.14.213.147","192.168.3.131","TLSv1","1484","Application Data, Application Data","443","52152"
"58","0.729334","72.14.213.147","192.168.3.131","TLSv1","1484","Application Data [TCP segment of a reassembled PDU]","443","52152"
"59","0.729335","72.14.213.147","192.168.3.131","TLSv1","131","Application Data","443","52152"
"60","0.729376","192.168.3.131","72.14.213.147","TCP","54","52152  >  443 [ACK] Seq=2528 Ack=23778 Win=65780 Len=0","52152","443"
"61","0.730119","72.14.213.147","192.168.3.131","TLSv1","1298","Application Data, Application Data, Application Data","443","52152"
"62","0.733395","72.14.213.147","192.168.3.131","TLSv1","135","Application Data","443","52152"
"63","0.733443","192.168.3.131","72.14.213.147","TCP","54","52152  >  443 [ACK] Seq=2528 Ack=25103 Win=64452 Len=0","52152","443"
"64","0.747383","72.14.213.147","192.168.3.131","TLSv1","87","Application Data","443","52152"
"65","0.781122","192.168.3.131","72.14.213.138","HTTP","999","GET /complete/search?client=chrome&hl=en-US&q=crai HTTP/1.1 ","57011","80"
"66","0.782570","65.55.206.209","192.168.3.131","HTTP","350","HTTP/1.1 301 Moved Permanently ","80","55953"
"67","0.815889","72.14.213.138","192.168.3.131","HTTP","523","HTTP/1.1 200 OK  (text/javascript)","80","57011"
"68","0.820093","72.14.213.147","192.168.3.131","TCP","60","[TCP ACKed unseen segment] 443  >  52152 [ACK] Seq=25136 Ack=4468 Win=22208 Len=0","443","52152"
"69","0.852832","192.168.3.131","65.55.17.37","TCP","66","55954  >  80 [SYN] Seq=0 Win=8192 Len=0 MSS=1460 WS=4 SACK_PERM=1","55954","80"
"70","0.858806","72.14.213.147","192.168.3.131","TCP","60","[TCP ACKed unseen segment] 443  >  52152 [ACK] Seq=25136 Ack=6494 Win=27904 Len=0","443","52152"
"71","0.869303","65.55.17.37","192.168.3.131","TCP","60","80  >  55954 [SYN, ACK] Seq=0 Ack=1 Win=8190 Len=0 MSS=1460","80","55954"
"72","0.869364","192.168.3.131","65.55.17.37","TCP","54","55954  >  80 [ACK] Seq=1 Ack=1 Win=64240 Len=0","55954","80"
"73","0.869606","192.168.3.131","65.55.17.37","HTTP","653","GET / HTTP/1.1 ","55954","80"
"74","0.903496","65.55.17.37","192.168.3.131","TCP","1514","80  >  55954 [ACK] Seq=1 Ack=600 Win=8190 Len=1460 [TCP segment of a reassembled PDU]","80","55954"
"75","0.904288","65.55.17.37","192.168.3.131","TCP","1514","80  >  55954 [ACK] Seq=1461 Ack=600 Win=8190 Len=1460 [TCP segment of a reassembled PDU]","80","55954"
"76","0.904310","192.168.3.131","65.55.17.37","TCP","54","55954  >  80 [ACK] Seq=600 Ack=2921 Win=64240 Len=0","55954","80"
"77","0.905057","65.55.17.37","192.168.3.131","TCP","1514","80  >  55954 [ACK] Seq=2921 Ack=600 Win=8190 Len=1460 [TCP segment of a reassembled PDU]","80","55954"
"78","0.905060","65.55.17.37","192.168.3.131","TCP","1514","80  >  55954 [ACK] Seq=4381 Ack=600 Win=8190 Len=1460 [TCP segment of a reassembled PDU]","80","55954"
"79","0.905088","192.168.3.131","65.55.17.37","TCP","54","55954  >  80 [ACK] Seq=600 Ack=5841 Win=64240 Len=0","55954","80"
"80","0.922438","65.55.17.37","192.168.3.131","TCP","1514","80  >  55954 [ACK] Seq=5841 Ack=600 Win=8190 Len=1460 [TCP segment of a reassembled PDU]","80","55954"
"81","0.923222","65.55.17.37","192.168.3.131","TCP","1514","80  >  55954 [ACK] Seq=7301 Ack=600 Win=8190 Len=1460 [TCP segment of a reassembled PDU]","80","55954"
"82","0.923223","65.55.17.37","192.168.3.131","TCP","1514","80  >  55954 [ACK] Seq=8761 Ack=600 Win=8190 Len=1460 [TCP segment of a reassembled PDU]","80","55954"
"83","0.923251","192.168.3.131","65.55.17.37","TCP","54","55954  >  80 [ACK] Seq=600 Ack=10221 Win=64240 Len=0","55954","80"
"84","0.924006","65.55.17.37","192.168.3.131","TCP","1514","80  >  55954 [ACK] Seq=10221 Ack=600 Win=8190 Len=1460 [TCP segment of a reassembled PDU]","80","55954"
"85","0.924754","65.55.17.37","192.168.3.131","TCP","1514","80  >  55954 [ACK] Seq=11681 Ack=600 Win=8190 Len=1460 [TCP segment of a reassembled PDU]","80","55954"
"86","0.924772","192.168.3.131","65.55.17.37","TCP","54","55954  >  80 [ACK] Seq=600 Ack=13141 Win=64240 Len=0","55954","80"
"87","0.925510","65.55.17.37","192.168.3.131","TCP","1514","80  >  55954 [PSH, ACK] Seq=13141 Ack=600 Win=8190 Len=1460 [TCP segment of a reassembled PDU]","80","55954"
"88","0.925511","65.55.17.37","192.168.3.131","TCP","1514","80  >  55954 [ACK] Seq=14601 Ack=600 Win=8190 Len=1460 [TCP segment of a reassembled PDU]","80","55954"
"89","0.925512","65.55.17.37","192.168.3.131","TCP","1514","80  >  55954 [ACK] Seq=16061 Ack=600 Win=8190 Len=1460 [TCP segment of a reassembled PDU]","80","55954"
"90","0.925542","192.168.3.131","65.55.17.37","TCP","54","55954  >  80 [ACK] Seq=600 Ack=17521 Win=64240 Len=0","55954","80"
"91","0.943443","65.55.17.37","192.168.3.131","TCP","1514","80  >  55954 [ACK] Seq=17521 Ack=600 Win=8190 Len=1460 [TCP segment of a reassembled PDU]","80","55954"
"92","0.944243","65.55.17.37","192.168.3.131","TCP","1514","80  >  55954 [ACK] Seq=18981 Ack=600 Win=8190 Len=1460 [TCP segment of a reassembled PDU]","80","55954"
"93","0.944245","65.55.17.37","192.168.3.131","TCP","1514","80  >  55954 [ACK] Seq=20441 Ack=600 Win=8190 Len=1460 [TCP segment of a reassembled PDU]","80","55954"
"94","0.944249","65.55.17.37","192.168.3.131","HTTP","1455","HTTP/1.1 200 OK  (text/html)","80","55954"
"95","0.944334","192.168.3.131","65.55.17.37","TCP","54","55954  >  80 [ACK] Seq=600 Ack=23302 Win=64240 Len=0","55954","80"
"96","0.947773","72.14.213.147","192.168.3.131","TLSv1","132","[TCP ACKed unseen segment] , Application Data","443","52152"
"97","0.948727","72.14.213.147","192.168.3.131","TLSv1","1369","[TCP ACKed unseen segment] , Application Data, Application Data","443","52152"
"98","0.948757","192.168.3.131","72.14.213.147","TCP","54","[TCP Previous segment not captured] 52152  >  443 [ACK] Seq=6494 Ack=26529 Win=65780 Len=0","52152","443"
"99","0.977559","192.168.3.131","207.46.148.38","TCP","66","55955  >  80 [SYN] Seq=0 Win=8192 Len=0 MSS=1460 WS=4 SACK_PERM=1","55955","80"
"100","0.982182","192.168.3.131","65.55.206.209","TCP","54","55953  >  80 [ACK] Seq=462 Ack=297 Win=63944 Len=0","55953","80"
"101","0.987988","72.14.213.147","192.168.3.131","TLSv1","113","[TCP ACKed unseen segment] , Application Data","443","52152"
"102","0.988780","72.14.213.147","192.168.3.131","TLSv1","845","Application Data, Application Data","443","52152"
"103","0.988806","192.168.3.131","72.14.213.147","TCP","54","52152  >  443 [ACK] Seq=6494 Ack=27379 Win=64928 Len=0","52152","443"
"104","0.989906","207.46.148.38","192.168.3.131","TCP","62","80  >  55955 [SYN, ACK] Seq=0 Ack=1 Win=8192 Len=0 MSS=1460 SACK_PERM=1","80","55955"
"105","0.989958","192.168.3.131","207.46.148.38","TCP","54","55955  >  80 [ACK] Seq=1 Ack=1 Win=64240 Len=0","55955","80"
"106","0.990227","192.168.3.131","207.46.148.38","HTTP","502","GET /action/MMN_Homepage HTTP/1.1 ","55955","80"
"107","1.005682","207.46.148.38","192.168.3.131","HTTP","333","HTTP/1.1 200 OK  (GIF89a)","80","55955"
"108","1.005759","192.168.3.131","207.46.148.38","TCP","54","55955  >  80 [ACK] Seq=449 Ack=281 Win=63961 Len=0","55955","80"
"109","1.006179","192.168.3.131","207.46.148.38","TCP","54","55955  >  80 [FIN, ACK] Seq=449 Ack=281 Win=63961 Len=0","55955","80"
"110","1.010656","192.168.3.131","66.235.139.121","TCP","66","55956  >  80 [SYN] Seq=0 Win=8192 Len=0 MSS=1460 WS=4 SACK_PERM=1","55956","80"
"111","1.015499","192.168.3.131","72.14.213.138","TCP","54","57011  >  80 [ACK] Seq=1889 Ack=856 Win=16445 Len=0","57011","80"
"112","1.027163","192.168.3.131","72.14.213.147","TLSv1","120","[TCP Previous segment not captured] , Application Data","52152","443"
"113","1.031197","207.46.148.38","192.168.3.131","TCP","60","80  >  55955 [ACK] Seq=281 Ack=450 Win=64240 Len=0","80","55955"
"114","1.033319","192.168.3.131","65.55.5.232","TCP","66","55957  >  80 [SYN] Seq=0 Win=8192 Len=0 MSS=1460 WS=4 SACK_PERM=1","55957","80"
"115","1.033862","192.168.3.131","65.55.239.163","TCP","66","55958  >  80 [SYN] Seq=0 Win=8192 Len=0 MSS=1460 WS=4 SACK_PERM=1","55958","80"
"116","1.043175","66.235.139.121","192.168.3.131","TCP","66","80  >  55956 [SYN, ACK] Seq=0 Ack=1 Win=4380 Len=0 MSS=1460 WS=1 SACK_PERM=1","80","55956"
"117","1.043239","192.168.3.131","66.235.139.121","TCP","54","55956  >  80 [ACK] Seq=1 Ack=1 Win=65700 Len=0","55956","80"
"118","1.043679","192.168.3.131","66.235.139.121","HTTP","1107","GET /b/ss/msnportalhomepagecaen/1/H.7-pdv-2/s84495919100008?[AQB]&ndh=1&t=25%2F0%2F2011%2010%3A52%3A23%202%20480&ns=msnportal&pageName=MSN%20CanadaMSFTW&g=http%3A%2F%2Fca.msn.com%2F&r=&s=1680x1050&c=32&k=Y&bw=1680&bh=949&hp=N&ch=&server=msn.com&c1=Portal&v1=1%2F2011&c2=en-ca&v2=1%2F25%2F2011&c3=12.0&c19=Dblu%2CW1%2CQ1%2C4.0&c22=True&c29=http%3A%2F%2Fca.msn.com%2F&c4=&cc=USD&ct=lan&v=Y&j=1.3&[AQE] HTTP/1.1 ","55956","80"
"119","1.047696","72.14.213.147","192.168.3.131","TCP","60","[TCP ACKed unseen segment] 443  >  52152 [ACK] Seq=27379 Ack=8378 Win=33664 Len=0","443","52152"
"120","1.051260","192.168.3.131","72.14.213.147","TLSv1","309","Application Data","52152","443"
"121","1.051349","65.55.5.232","192.168.3.131","TCP","60","80  >  55957 [SYN, ACK] Seq=0 Ack=1 Win=8190 Len=0 MSS=1460","80","55957"
"122","1.051411","192.168.3.131","65.55.5.232","TCP","54","55957  >  80 [ACK] Seq=1 Ack=1 Win=64240 Len=0","55957","80"
"123","1.051750","192.168.3.131","65.55.5.232","HTTP","701","GET /ADSAdClient31.dll?GetSAd=&DPJS=0&PN=MSFT&PG=CAE9TX&AP=1389 HTTP/1.1 ","55957","80"
"124","1.069948","72.14.213.147","192.168.3.131","TCP","60","443  >  52152 [ACK] Seq=27379 Ack=8699 Win=36480 Len=0","443","52152"
"125","1.071296","65.55.5.232","192.168.3.131","HTTP","1066","HTTP/1.1 200 OK  (text/html)","80","55957"
"126","1.080227","66.235.139.121","192.168.3.131","HTTP","734","HTTP/1.1 302 Found ","80","55956"
"127","1.112893","65.55.239.163","192.168.3.131","TCP","60","80  >  55958 [SYN, ACK] Seq=0 Ack=1 Win=8190 Len=0 MSS=1460","80","55958"
"128","1.112950","192.168.3.131","65.55.239.163","TCP","54","55958  >  80 [ACK] Seq=1 Ack=1 Win=64240 Len=0","55958","80"
"129","1.113300","192.168.3.131","65.55.239.163","HTTP","632","GET /c.gif?di=210&pi=11654&ps=10274&tp=http://ca.msn.com/ca.msn.com/default.aspxW&rf= HTTP/1.1 ","55958","80"
"130","1.113923","72.14.213.147","192.168.3.131","TLSv1","176","Application Data","443","52152"
"131","1.114710","72.14.213.147","192.168.3.131","TLSv1","87","Application Data","443","52152"
"132","1.114730","192.168.3.131","72.14.213.147","TCP","54","52152  >  443 [ACK] Seq=8699 Ack=27534 Win=64772 Len=0","52152","443"
"133","1.118365","192.168.3.131","65.55.5.231","TCP","66","55959  >  80 [SYN] Seq=0 Win=8192 Len=0 MSS=1460 WS=4 SACK_PERM=1","55959","80"
"134","1.135895","65.55.5.231","192.168.3.131","TCP","60","80  >  55959 [SYN, ACK] Seq=0 Ack=1 Win=8190 Len=0 MSS=1460","80","55959"
"135","1.135949","192.168.3.131","65.55.5.231","TCP","54","55959  >  80 [ACK] Seq=1 Ack=1 Win=64240 Len=0","55959","80"
"136","1.136332","192.168.3.131","65.55.5.231","HTTP","703","GET /ADSAdClient31.dll?GetSAd=&DPJS=0&PN=MSFT&PG=CAE9UT&AP=1440 HTTP/1.1 ","55959","80"
"137","1.155744","65.55.5.231","192.168.3.131","HTTP","1066","HTTP/1.1 200 OK  (text/html)","80","55959"
"138","1.160942","72.14.213.147","192.168.3.131","TLSv1","110","Application Data","443","52152"
"139","1.161740","72.14.213.147","192.168.3.131","TLSv1","514","Application Data, Application Data","443","52152"
"140","1.161786","192.168.3.131","72.14.213.147","TCP","54","52152  >  443 [ACK] Seq=8699 Ack=28050 Win=65780 Len=0","52152","443"
"141","1.168112","192.168.3.131","206.108.207.139","TCP","66","55960  >  80 [SYN] Seq=0 Win=8192 Len=0 MSS=1460 WS=4 SACK_PERM=1","55960","80"
"142","1.175006","192.168.3.131","184.24.133.32","TCP","66","55961  >  80 [SYN] Seq=0 Win=8192 Len=0 MSS=1460 WS=4 SACK_PERM=1","55961","80"
"143","1.177821","206.108.207.139","192.168.3.131","TCP","66","80  >  55960 [SYN, ACK] Seq=0 Ack=1 Win=5840 Len=0 MSS=1460 SACK_PERM=1 WS=32","80","55960"
"144","1.177878","192.168.3.131","206.108.207.139","TCP","54","55960  >  80 [ACK] Seq=1 Ack=1 Win=65700 Len=0","55960","80"
"145","1.178219","192.168.3.131","206.108.207.139","HTTP","565","GET /r?c2=3000001&d.c=gif&d.o=msnportalhomepagecaen&d.x=184063711&d.t=page&d.u=http%3A%2F%2Fca.msn.com%2F HTTP/1.1 ","55960","80"
"146","1.187316","206.108.207.139","192.168.3.131","TCP","60","80  >  55960 [ACK] Seq=1 Ack=512 Win=6912 Len=0","80","55960"
"147","1.188093","206.108.207.139","192.168.3.131","HTTP","576","HTTP/1.1 200 OK  (GIF89a)","80","55960"
"148","1.188914","184.24.133.32","192.168.3.131","TCP","66","80  >  55961 [SYN, ACK] Seq=0 Ack=1 Win=5840 Len=0 MSS=1460 SACK_PERM=1 WS=32","80","55961"
"149","1.188961","192.168.3.131","184.24.133.32","TCP","54","55961  >  80 [ACK] Seq=1 Ack=1 Win=65700 Len=0","55961","80"
"150","1.190667","192.168.3.131","184.24.133.32","HTTP","758","GET /scripts/beacon.dll?c1=2&c2=2128&c3=&c4=&c5=&c6=&c7=http%3A//ca.msn.com/&c8=MSN%20Canada%20-%20The%20home%20of%20world-class%20services%20such%20as%20Hotmail%2C%20Windows%20Live%20Messenger%2C%20and%20News%2C%20Sports%2C%20Financial%20and%20Entertainment&c9=&c10=1680x1050&rn=1295981543432 HTTP/1.1 ","55961","80"
"151","1.193330","65.55.239.163","192.168.3.131","HTTP","465","HTTP/1.1 200 OK  (GIF89a)","80","55958"
"152","1.202810","184.24.133.32","192.168.3.131","TCP","60","80  >  55961 [ACK] Seq=1 Ack=705 Win=7264 Len=0","80","55961"
"153","1.203871","184.24.133.32","192.168.3.131","HTTP","576","HTTP/1.1 200 OK  (GIF89a)","80","55961"
"154","1.270317","192.168.3.131","65.55.5.232","TCP","66","55962  >  80 [SYN] Seq=0 Win=8192 Len=0 MSS=1460 WS=4 SACK_PERM=1","55962","80"
"155","1.277184","192.168.3.131","65.55.5.232","TCP","54","55957  >  80 [ACK] Seq=648 Ack=1013 Win=63228 Len=0","55957","80"
"156","1.278165","192.168.3.131","66.235.139.121","TCP","54","55956  >  80 [ACK] Seq=1054 Ack=681 Win=65020 Len=0","55956","80"
"157","1.288204","65.55.5.232","192.168.3.131","TCP","60","80  >  55962 [SYN, ACK] Seq=0 Ack=1 Win=8190 Len=0 MSS=1460","80","55962"
"158","1.288264","192.168.3.131","65.55.5.232","TCP","54","55962  >  80 [ACK] Seq=1 Ack=1 Win=64240 Len=0","55962","80"
"159","1.288453","192.168.3.131","65.55.5.232","HTTP","703","GET /ADSAdClient31.dll?GetSAd=&DPJS=0&PN=MSFT&PG=CAEREC&AP=1089 HTTP/1.1 ","55962","80"
"160","1.308947","65.55.5.232","192.168.3.131","HTTP","1360","HTTP/1.1 200 OK  (text/html)","80","55962"
"161","1.348198","192.168.3.131","65.55.5.231","TCP","54","55959  >  80 [ACK] Seq=650 Ack=1013 Win=63228 Len=0","55959","80"
"162","1.356724","192.168.3.131","65.54.95.140","TCP","66","55963  >  80 [SYN] Seq=0 Win=8192 Len=0 MSS=1460 WS=4 SACK_PERM=1","55963","80"
"163","1.369207","65.54.95.140","192.168.3.131","TCP","66","80  >  55963 [SYN, ACK] Seq=0 Ack=1 Win=65535 Len=0 MSS=1460 WS=16 SACK_PERM=1","80","55963"
"164","1.369256","192.168.3.131","65.54.95.140","TCP","54","55963  >  80 [ACK] Seq=1 Ack=1 Win=65700 Len=0","55963","80"
"165","1.369435","192.168.3.131","65.54.95.140","HTTP","451","GET /i/94/9BE085B9BAD824CEB7C33F498354B.jpg HTTP/1.1 ","55963","80"
"166","1.383210","65.54.95.140","192.168.3.131","TCP","1514","80  >  55963 [ACK] Seq=1 Ack=398 Win=65696 Len=1460 [TCP segment of a reassembled PDU]","80","55963"
"167","1.384016","65.54.95.140","192.168.3.131","TCP","1514","80  >  55963 [ACK] Seq=1461 Ack=398 Win=65696 Len=1460 [TCP segment of a reassembled PDU]","80","55963"
"168","1.384037","192.168.3.131","65.54.95.140","TCP","54","55963  >  80 [ACK] Seq=398 Ack=2921 Win=65700 Len=0","55963","80"
"169","1.390205","192.168.3.131","65.55.239.163","TCP","54","55958  >  80 [ACK] Seq=579 Ack=412 Win=63829 Len=0","55958","80"
"170","1.397197","192.168.3.131","206.108.207.139","TCP","54","55960  >  80 [ACK] Seq=512 Ack=523 Win=65176 Len=0","55960","80"
"171","1.397580","65.54.95.140","192.168.3.131","HTTP","373","HTTP/1.1 200 OK  (JPEG JFIF image)","80","55963"
"172","1.406181","192.168.3.131","184.24.133.32","TCP","54","55961  >  80 [ACK] Seq=705 Ack=523 Win=65176 Len=0","55961","80"
"173","1.496915","192.168.3.131","63.215.202.48","TCP","66","55966  >  80 [SYN] Seq=0 Win=8192 Len=0 MSS=1460 WS=4 SACK_PERM=1","55966","80"
"174","1.514247","192.168.3.131","65.55.5.232","TCP","54","55962  >  80 [ACK] Seq=650 Ack=1307 Win=62934 Len=0","55962","80"
"175","1.568148","63.215.202.48","192.168.3.131","TCP","60","80  >  55966 [SYN, ACK] Seq=0 Ack=1 Win=8190 Len=0 MSS=1460","80","55966"
"176","1.568280","192.168.3.131","63.215.202.48","TCP","54","55966  >  80 [ACK] Seq=1 Ack=1 Win=64240 Len=0","55966","80"
"177","1.568779","192.168.3.131","63.215.202.48","HTTP","569","GET /ad/js/12308-120034-30721-0?mpt=[1627390274ER]&mpvc= HTTP/1.1 ","55966","80"
"178","1.606226","192.168.3.131","65.54.95.140","TCP","54","55963  >  80 [ACK] Seq=398 Ack=3240 Win=65380 Len=0","55963","80"
"179","1.640650","63.215.202.48","192.168.3.131","HTTP","678","HTTP/1.1 302 Moved Temporarily ","80","55966"
"180","1.714140","192.168.3.131","72.14.213.138","HTTP","1005","GET /complete/search?client=chrome&hl=en-US&q=craigslist HTTP/1.1 ","57011","80"
"181","1.748064","72.14.213.138","192.168.3.131","HTTP","533","HTTP/1.1 200 OK  (text/javascript)","80","57011"
"182","1.768129","192.168.3.131","63.215.202.49","TCP","66","55967  >  80 [SYN] Seq=0 Win=8192 Len=0 MSS=1460 WS=4 SACK_PERM=1","55967","80"
"183","1.836397","63.215.202.49","192.168.3.131","TCP","60","80  >  55967 [SYN, ACK] Seq=0 Ack=1 Win=8190 Len=0 MSS=1460","80","55967"
"184","1.836456","192.168.3.131","63.215.202.49","TCP","54","55967  >  80 [ACK] Seq=1 Ack=1 Win=64240 Len=0","55967","80"
"185","1.836827","192.168.3.131","63.215.202.49","HTTP","694","GET /content/0/12308/120034/1326513_300x250_new_year_v130_trend_en_c02.js?mpck=altfarm.mediaplex.com%2Fad%2Fck%2F12308-120034-30721-0%3Fmpt%3D%5B1627390274ER%5D&mpt=[1627390274ER]&mpvc= HTTP/1.1 ","55967","80"
"186","1.846265","192.168.3.131","63.215.202.48","TCP","54","55966  >  80 [ACK] Seq=516 Ack=625 Win=63616 Len=0","55966","80"
"187","1.907889","63.215.202.49","192.168.3.131","TCP","1514","80  >  55967 [ACK] Seq=1 Ack=641 Win=16380 Len=1460 [TCP segment of a reassembled PDU]","80","55967"
"188","1.908696","63.215.202.49","192.168.3.131","TCP","1514","80  >  55967 [ACK] Seq=1461 Ack=641 Win=16380 Len=1460 [TCP segment of a reassembled PDU]","80","55967"
"189","1.908697","63.215.202.49","192.168.3.131","HTTP","1336","HTTP/1.1 200 OK  (application/x-javascript)","80","55967"
"190","1.908741","192.168.3.131","63.215.202.49","TCP","54","55967  >  80 [ACK] Seq=641 Ack=4203 Win=64240 Len=0","55967","80"
"191","1.945641","192.168.3.131","65.55.5.232","HTTP","701","GET /ADSAdClient31.dll?GetSAd=&DPJS=0&PN=MSFT&PG=CAIPBB&AP=1455 HTTP/1.1 ","55957","80"
"192","1.953479","192.168.3.131","72.14.213.138","TCP","54","57011  >  80 [ACK] Seq=2840 Ack=1335 Win=16325 Len=0","57011","80"
"193","1.964945","65.55.5.232","192.168.3.131","HTTP","931","HTTP/1.1 200 OK  (text/html)","80","55957"
"194","2.164272","192.168.3.131","65.55.5.232","TCP","54","55957  >  80 [ACK] Seq=1295 Ack=1890 Win=64240 Len=0","55957","80"
"195","2.516837","192.168.3.131","72.14.213.101","TCP","66","55968  >  80 [SYN] Seq=0 Win=8192 Len=0 MSS=1460 WS=4 SACK_PERM=1","55968","80"
"196","2.536002","72.14.213.101","192.168.3.131","TCP","66","80  >  55968 [SYN, ACK] Seq=0 Ack=1 Win=5720 Len=0 MSS=1430 SACK_PERM=1 WS=64","80","55968"
"197","2.536062","192.168.3.131","72.14.213.101","TCP","54","55968  >  80 [ACK] Seq=1 Ack=1 Win=65780 Len=0","55968","80"
"198","2.536344","192.168.3.131","72.14.213.101","TCP","1423","55968  >  80 [PSH, ACK] Seq=1 Ack=1 Win=65780 Len=1369 [TCP segment of a reassembled PDU]","55968","80"
"199","2.536370","192.168.3.131","72.14.213.101","HTTP/XML","333","POST /tbproxy/af/query HTTP/1.1 ","55968","80"
"200","2.556584","72.14.213.101","192.168.3.131","TCP","60","80  >  55968 [ACK] Seq=1 Ack=1370 Win=8512 Len=0","80","55968"
"201","2.557352","72.14.213.101","192.168.3.131","TCP","60","80  >  55968 [ACK] Seq=1 Ack=1649 Win=11200 Len=0","80","55968"
"202","2.557482","192.168.3.131","65.55.17.37","TCP","66","55971  >  80 [SYN] Seq=0 Win=8192 Len=0 MSS=1460 WS=4 SACK_PERM=1","55971","80"
"203","2.557884","192.168.3.131","65.55.17.37","HTTP","640","GET /ajax/Horoscope.aspx?zodiacsign=ari&lcid=en-ca HTTP/1.1 ","55954","80"
"204","2.559625","72.14.213.101","192.168.3.131","HTTP/XML","356","HTTP/1.1 200 OK ","80","55968"
"205","2.560320","192.168.3.131","72.14.213.147","HTTP","1134","GET /search?aq=f&sourceid=chrome&ie=UTF-8&q=craigslist+kelowna HTTP/1.1 ","57839","80"
"206","2.575433","65.55.17.37","192.168.3.131","TCP","60","80  >  55971 [SYN, ACK] Seq=0 Ack=1 Win=8190 Len=0 MSS=1460","80","55971"
"207","2.575507","192.168.3.131","65.55.17.37","TCP","54","55971  >  80 [ACK] Seq=1 Ack=1 Win=64240 Len=0","55971","80"
"208","2.576440","192.168.3.131","65.55.17.37","HTTP","606","GET /ajax/I.aspx HTTP/1.1 ","55971","80"
"209","2.577789","65.55.17.37","192.168.3.131","HTTP/XML","797","HTTP/1.1 200 OK ","80","55954"
"210","2.579752","72.14.213.147","192.168.3.131","TCP","60","80  >  57839 [ACK] Seq=1 Ack=1081 Win=1002 Len=0","80","57839"
"211","2.590176","72.14.213.147","192.168.3.131","TCP","1246","80  >  57839 [PSH, ACK] Seq=1 Ack=1081 Win=1002 Len=1192 [TCP segment of a reassembled PDU]","80","57839"
"212","2.591025","72.14.213.147","192.168.3.131","TCP","1484","80  >  57839 [ACK] Seq=1193 Ack=1081 Win=1002 Len=1430 [TCP segment of a reassembled PDU]","80","57839"
"213","2.591027","72.14.213.147","192.168.3.131","TCP","1484","80  >  57839 [ACK] Seq=2623 Ack=1081 Win=1002 Len=1430 [TCP segment of a reassembled PDU]","80","57839"
"214","2.591030","72.14.213.147","192.168.3.131","TCP","774","80  >  57839 [PSH, ACK] Seq=4053 Ack=1081 Win=1002 Len=720 [TCP segment of a reassembled PDU]","80","57839"
"215","2.591095","192.168.3.131","72.14.213.147","TCP","54","57839  >  80 [ACK] Seq=1081 Ack=4773 Win=16445 Len=0","57839","80"
"216","2.596572","65.55.17.37","192.168.3.131","HTTP/XML","909","HTTP/1.1 200 OK ","80","55971"
"217","2.610272","192.168.3.131","65.55.17.37","HTTP","706","GET /blank.aspx?1295981545068 HTTP/1.1 ","55954","80"
"218","2.616322","192.168.3.131","65.55.17.37","TCP","54","55954  >  80 [FIN, ACK] Seq=1838 Ack=24045 Win=63497 Len=0","55954","80"
"219","2.629484","65.55.17.37","192.168.3.131","HTTP","480","HTTP/1.1 200 OK  (text/html)","80","55954"
"220","2.629550","192.168.3.131","65.55.17.37","TCP","54","55954  >  80 [RST, ACK] Seq=1839 Ack=24471 Win=0 Len=0","55954","80"
"221","2.631717","192.168.3.131","65.54.95.140","HTTP","452","GET /i/D6/8E763C825DC0E388929AE1B375CE18.JPG HTTP/1.1 ","55963","80"
"222","2.642895","192.168.3.131","207.46.216.54","TCP","66","55972  >  80 [SYN] Seq=0 Win=8192 Len=0 MSS=1460 WS=4 SACK_PERM=1","55972","80"
"223","2.643272","192.168.3.131","65.54.95.142","TCP","66","55973  >  80 [SYN] Seq=0 Win=8192 Len=0 MSS=1460 WS=4 SACK_PERM=1","55973","80"
"224","2.643417","192.168.3.131","66.235.139.121","HTTP","1202","GET /b/ss/msnportalhomepagecaen/1/H.7-pdv-2/s81580283869989?[AQB]&ndh=1&t=25%2F0%2F2011%2010%3A52%3A23%202%20480&ns=msnportal&pageName=MSN%20CanadaMSFTW&g=http%3A%2F%2Fca.msn.com%2F&r=&s=1680x1050&c=32&k=Y&bw=1680&bh=949&hp=N&events=event4&c12=http%3A%2F%2Fca.msn.com%2F%23&c13=wrapper%3EticklerI&c15=1&c16=IEAKTickler%20Prompt%20shown&c17=MSN%20CanadaMSFTW%3AMSFT&c18=&c38=12.0&v12=http%3A%2F%2Fca.msn.com%2F%23&v11=IEAKTickler%20Prompt%20shown&pe=lnk_o&pev2=IEAKTickler%20Prompt%20shown&[AQE] HTTP/1.1 ","55956","80"
"225","2.643513","192.168.3.131","65.55.17.37","HTTP","717","GET /blank.aspx?1295981545103 HTTP/1.1 ","55971","80"
"226","2.646598","65.54.95.140","192.168.3.131","HTTP","1125","HTTP/1.1 200 OK  (JPEG JFIF image)","80","55963"
"227","2.656153","207.46.216.54","192.168.3.131","TCP","60","80  >  55972 [SYN, ACK] Seq=0 Ack=1 Win=8190 Len=0 MSS=1460","80","55972"
"228","2.656212","192.168.3.131","207.46.216.54","TCP","54","55972  >  80 [ACK] Seq=1 Ack=1 Win=64240 Len=0","55972","80"
"229","2.656409","192.168.3.131","207.46.216.54","HTTP","584","GET /_0nwenca0/00/00?http://ca.msn.com/&&ps=10274&pi=11654&di=210&gt1=&ce=1&cm=wrapper%3EticklerI&hl=IEAKTickler%20Prompt%20shown&su=http%3A%2F%2Fca.msn.com%2Fca.msn.com%2Fdefault.aspxW HTTP/1.1 ","55972","80"
"230","2.656969","65.54.95.142","192.168.3.131","TCP","66","80  >  55973 [SYN, ACK] Seq=0 Ack=1 Win=65535 Len=0 MSS=1460 WS=16 SACK_PERM=1","80","55973"
"231","2.656994","192.168.3.131","65.54.95.142","TCP","54","55973  >  80 [ACK] Seq=1 Ack=1 Win=65700 Len=0","55973","80"
"232","2.657127","192.168.3.131","65.54.95.142","HTTP","442","GET /br/hp/11/i/en_ie8-tickler.jpg HTTP/1.1 ","55973","80"
"233","2.665702","65.55.17.37","192.168.3.131","HTTP","480","HTTP/1.1 200 OK  (text/html)","80","55971"
"234","2.669132","207.46.216.54","192.168.3.131","HTTP","264","HTTP/1.1 204 No Content ","80","55972"
"235","2.671360","65.54.95.142","192.168.3.131","TCP","1514","80  >  55973 [ACK] Seq=1 Ack=389 Win=65696 Len=1460 [TCP segment of a reassembled PDU]","80","55973"
"236","2.672125","65.54.95.142","192.168.3.131","TCP","1514","80  >  55973 [ACK] Seq=1461 Ack=389 Win=65696 Len=1460 [TCP segment of a reassembled PDU]","80","55973"
"237","2.672126","65.54.95.142","192.168.3.131","TCP","1514","80  >  55973 [ACK] Seq=2921 Ack=389 Win=65696 Len=1460 [TCP segment of a reassembled PDU]","80","55973"
"238","2.672152","192.168.3.131","65.54.95.142","TCP","54","55973  >  80 [ACK] Seq=389 Ack=4381 Win=65700 Len=0","55973","80"
"239","2.679469","66.235.139.121","192.168.3.131","HTTP","631","HTTP/1.1 200 OK  (GIF89a)","80","55956"
"240","2.685425","72.14.213.147","192.168.3.131","TCP","1484","80  >  57839 [ACK] Seq=4773 Ack=1081 Win=1002 Len=1430 [TCP segment of a reassembled PDU]","80","57839"
"241","2.686275","72.14.213.147","192.168.3.131","TCP","1484","80  >  57839 [ACK] Seq=6203 Ack=1081 Win=1002 Len=1430 [TCP segment of a reassembled PDU]","80","57839"
"242","2.686309","192.168.3.131","72.14.213.147","TCP","54","57839  >  80 [ACK] Seq=1081 Ack=7633 Win=16445 Len=0","57839","80"
"243","2.686612","65.54.95.142","192.168.3.131","TCP","1514","80  >  55973 [ACK] Seq=4381 Ack=389 Win=65696 Len=1460 [TCP segment of a reassembled PDU]","80","55973"
"244","2.687110","72.14.213.147","192.168.3.131","TCP","917","80  >  57839 [PSH, ACK] Seq=7633 Ack=1081 Win=1002 Len=863 [TCP segment of a reassembled PDU]","80","57839"
"245","2.687402","65.54.95.142","192.168.3.131","TCP","1514","80  >  55973 [ACK] Seq=5841 Ack=389 Win=65696 Len=1460 [TCP segment of a reassembled PDU]","80","55973"
"246","2.687427","192.168.3.131","65.54.95.142","TCP","54","55973  >  80 [ACK] Seq=389 Ack=7301 Win=65700 Len=0","55973","80"
"247","2.688177","65.54.95.142","192.168.3.131","TCP","1514","80  >  55973 [ACK] Seq=7301 Ack=389 Win=65696 Len=1460 [TCP segment of a reassembled PDU]","80","55973"
"248","2.688178","65.54.95.142","192.168.3.131","TCP","1514","80  >  55973 [ACK] Seq=8761 Ack=389 Win=65696 Len=1460 [TCP segment of a reassembled PDU]","80","55973"
"249","2.688201","192.168.3.131","65.54.95.142","TCP","54","55973  >  80 [ACK] Seq=389 Ack=10221 Win=65700 Len=0","55973","80"
"250","2.689732","65.54.95.142","192.168.3.131","TCP","1514","80  >  55973 [ACK] Seq=10221 Ack=389 Win=65696 Len=1460 [TCP segment of a reassembled PDU]","80","55973"
"251","2.691095","65.54.95.142","192.168.3.131","TCP","1514","80  >  55973 [ACK] Seq=11681 Ack=389 Win=65696 Len=1460 [TCP segment of a reassembled PDU]","80","55973"
"252","2.691124","192.168.3.131","65.54.95.142","TCP","54","55973  >  80 [ACK] Seq=389 Ack=13141 Win=65700 Len=0","55973","80"
"253","2.691644","72.14.213.147","192.168.3.131","HTTP","1401","HTTP/1.1 200 OK ","80","57839"
"254","2.691709","192.168.3.131","72.14.213.147","TCP","54","57839  >  80 [ACK] Seq=1081 Ack=9843 Win=16445 Len=0","57839","80"
"255","2.691864","65.54.95.142","192.168.3.131","TCP","1514","80  >  55973 [ACK] Seq=13141 Ack=389 Win=65696 Len=1460 [TCP segment of a reassembled PDU]","80","55973"
"256","2.692619","65.54.95.142","192.168.3.131","TCP","1514","80  >  55973 [ACK] Seq=14601 Ack=389 Win=65696 Len=1460 [TCP segment of a reassembled PDU]","80","55973"
"257","2.692637","192.168.3.131","65.54.95.142","TCP","54","55973  >  80 [ACK] Seq=389 Ack=16061 Win=65700 Len=0","55973","80"
"258","2.693378","65.54.95.142","192.168.3.131","TCP","1514","80  >  55973 [ACK] Seq=16061 Ack=389 Win=65696 Len=1460 [TCP segment of a reassembled PDU]","80","55973"
"259","2.693379","65.54.95.142","192.168.3.131","TCP","1514","80  >  55973 [ACK] Seq=17521 Ack=389 Win=65696 Len=1460 [TCP segment of a reassembled PDU]","80","55973"
"260","2.693404","192.168.3.131","65.54.95.142","TCP","54","55973  >  80 [ACK] Seq=389 Ack=18981 Win=65700 Len=0","55973","80"
"261","2.696850","65.54.95.142","192.168.3.131","TCP","1514","80  >  55973 [ACK] Seq=18981 Ack=389 Win=65696 Len=1460 [TCP segment of a reassembled PDU]","80","55973"
"262","2.697842","65.54.95.142","192.168.3.131","TCP","1514","80  >  55973 [ACK] Seq=20441 Ack=389 Win=65696 Len=1460 [TCP segment of a reassembled PDU]","80","55973"
"263","2.697869","192.168.3.131","65.54.95.142","TCP","54","55973  >  80 [ACK] Seq=389 Ack=21901 Win=65700 Len=0","55973","80"
"264","2.698618","65.54.95.142","192.168.3.131","TCP","1514","80  >  55973 [ACK] Seq=21901 Ack=389 Win=65696 Len=1460 [TCP segment of a reassembled PDU]","80","55973"
"265","2.698621","65.54.95.142","192.168.3.131","TCP","1514","80  >  55973 [ACK] Seq=23361 Ack=389 Win=65696 Len=1460 [TCP segment of a reassembled PDU]","80","55973"
"266","2.698649","192.168.3.131","65.54.95.142","TCP","54","55973  >  80 [ACK] Seq=389 Ack=24821 Win=65700 Len=0","55973","80"
"267","2.699396","65.54.95.142","192.168.3.131","TCP","1514","80  >  55973 [ACK] Seq=24821 Ack=389 Win=65696 Len=1460 [TCP segment of a reassembled PDU]","80","55973"
"268","2.701090","65.54.95.142","192.168.3.131","TCP","1514","80  >  55973 [ACK] Seq=26281 Ack=389 Win=65696 Len=1460 [TCP segment of a reassembled PDU]","80","55973"
"269","2.701111","192.168.3.131","65.54.95.142","TCP","54","55973  >  80 [ACK] Seq=389 Ack=27741 Win=65700 Len=0","55973","80"
"270","2.701854","65.54.95.142","192.168.3.131","TCP","1514","80  >  55973 [ACK] Seq=27741 Ack=389 Win=65696 Len=1460 [TCP segment of a reassembled PDU]","80","55973"
"271","2.702612","65.54.95.142","192.168.3.131","TCP","1514","80  >  55973 [ACK] Seq=29201 Ack=389 Win=65696 Len=1460 [TCP segment of a reassembled PDU]","80","55973"
"272","2.702639","192.168.3.131","65.54.95.142","TCP","54","55973  >  80 [ACK] Seq=389 Ack=30661 Win=65700 Len=0","55973","80"
"273","2.703380","65.54.95.142","192.168.3.131","TCP","1514","80  >  55973 [ACK] Seq=30661 Ack=389 Win=65696 Len=1460 [TCP segment of a reassembled PDU]","80","55973"
"274","2.703381","65.54.95.142","192.168.3.131","HTTP","1138","HTTP/1.1 200 OK  (JPEG JFIF image)","80","55973"
"275","2.703401","192.168.3.131","65.54.95.142","TCP","54","55973  >  80 [ACK] Seq=389 Ack=33205 Win=65700 Len=0","55973","80"
"276","2.762249","192.168.3.131","72.14.213.101","TCP","54","55968  >  80 [ACK] Seq=1649 Ack=303 Win=65476 Len=0","55968","80"
"277","2.778596","72.14.213.101","192.168.3.131","HTTP/XML","356","[TCP Spurious Retransmission] HTTP/1.1 200 OK ","80","55968"
"278","2.778630","192.168.3.131","72.14.213.101","TCP","66","[TCP Dup ACK 276#1] 55968  >  80 [ACK] Seq=1649 Ack=303 Win=65476 Len=0 SLE=1 SRE=303","55968","80"
"279","2.810162","192.168.3.131","72.14.213.147","HTTP","1266","GET /csi?v=3&s=web&action=&srt=50&e=17259,18167,25907,27893,28186,28254&ei=Fh8_TfP6KITSsAP30anUBQ&expi=17259,18167,25907,27893,28186,28254&imc=3&imn=3&imp=0&rt=xjsls.114,prt.115,xjses.124,xjsee.166,xjs.184,ol.206,iml.115 HTTP/1.1 ","57839","80"
"280","2.847305","192.168.3.131","65.54.95.140","TCP","54","55963  >  80 [ACK] Seq=796 Ack=4311 Win=64308 Len=0","55963","80"
"281","2.863327","192.168.3.131","65.55.17.37","TCP","54","55971  >  80 [ACK] Seq=1216 Ack=1282 Win=62959 Len=0","55971","80"
"282","2.872041","72.14.213.147","192.168.3.131","TCP","60","80  >  57839 [ACK] Seq=9843 Ack=2293 Win=1002 Len=0","80","57839"
"283","2.872318","192.168.3.131","207.46.216.54","TCP","54","55972  >  80 [ACK] Seq=531 Ack=211 Win=64030 Len=0","55972","80"
"284","2.875773","72.14.213.147","192.168.3.131","HTTP","269","HTTP/1.1 204 No Content ","80","57839"
"285","2.882313","192.168.3.131","66.235.139.121","TCP","54","55956  >  80 [ACK] Seq=2202 Ack=1258 Win=64440 Len=0","55956","80"
"286","3.079492","192.168.3.131","72.14.213.147","TCP","54","57839  >  80 [ACK] Seq=2293 Ack=10058 Win=16391 Len=0","57839","80"
"287","4.020298","192.168.3.131","72.14.213.147","HTTP","1157","GET /url?sa=T&source=web&cd=1&ved=0CBUQFjAA&url=http%3A%2F%2Fkelowna.craigslist.ca%2F&ei=Fh8_TfP6KITSsAP30anUBQ HTTP/1.1 ","57839","80"
"288","4.041095","72.14.213.147","192.168.3.131","TCP","60","80  >  57839 [ACK] Seq=10058 Ack=3396 Win=1002 Len=0","80","57839"
"289","4.047620","72.14.213.147","192.168.3.131","HTTP","323","HTTP/1.1 204 No Content ","80","57839"
"290","4.125172","192.168.3.131","208.82.236.129","TCP","66","58264  >  80 [SYN] Seq=0 Win=8192 Len=0 MSS=1460 WS=4 SACK_PERM=1","58264","80"
"291","4.149716","192.168.3.131","65.54.95.140","HTTP","452","GET /i/86/998863E64E6ED2A022EECB50A53CC3.jpg HTTP/1.1 ","55963","80"
